set global storage_engine=Maria;
set session storage_engine=Maria;
create table t1 (a int);
insert into t1 values (0),(1),(2),(3),(4),(5),(6),(7),(8),(9);
create table t2 (a int, filler char(200), key(a));
insert into t2 select C.a*2,   'no'  from t1 A, t1 B, t1 C;
insert into t2 select C.a*2+1, 'yes' from t1 C;
select * from t2 where a NOT IN (0, 2,4,6,8,10,12,14,16,18);
a	filler
1	yes
11	yes
13	yes
15	yes
17	yes
19	yes
3	yes
5	yes
7	yes
9	yes
drop table t1,t2;
CREATE TABLE t1 (a varchar(32), b char(3), UNIQUE KEY a (a,b), KEY b (b));
INSERT INTO t1 (a, b) VALUES
( 'ppfcz1', 'DE'), ( 'ppfcz1', 'FR');
CREATE TABLE t2 (a varchar(32), b int(11), c float, d double, 
UNIQUE KEY a (a,b,c));
INSERT INTO t2 (a, b, c, d) VALUES
( 'ppfcz1', 14, 5, 48.5), ( 'ppfcz1', 14, 6, 52.5);
SELECT t1.a,t2.a,t2.c,t2.d FROM t1, t2
WHERE t2.b=14 AND t2.a=t1.a AND 5.1<t2.c AND t1.b='DE';
a	a	c	d
ppfcz1	ppfcz1	6	52.5
drop table t1,t2;
CREATE TABLE t1(c1 FLOAT(10,5) UNSIGNED NOT NULL, c2 FLOAT(10,5) SIGNED NULL, c3 FLOAT, c4 INT, UNIQUE INDEX idx(c1,c2));
INSERT INTO t1 VALUES('00100.05000','-00100.05000','00100.05000',1);
INSERT INTO t1(c1) VALUES('12345.000009');
INSERT INTO t1 VALUES('99999.99999','-99999.99999','99999.99999',3);
DELETE FROM t1 WHERE c1='100000.00000' AND c2='-100000.00000';
INSERT INTO t1 VALUES('100000.000002','-100000.000002','100000.000002',5);
Warnings:
Warning	1264	Out of range value for column 'c1' at row 1
Warning	1264	Out of range value for column 'c2' at row 1
insert into t1 values ("0.0","0.0","0.0",7),("01.0","01.0","01.0",10);
insert into t1 values ("-.1","-.1","-.1",13);
Warnings:
Warning	1264	Out of range value for column 'c1' at row 1
insert into t1 values ("+111111111.11","+111111111.11","+111111111.11",19);
Warnings:
Warning	1264	Out of range value for column 'c1' at row 1
Warning	1264	Out of range value for column 'c2' at row 1
SELECT * FROM t1;
c1	c2	c3	c4
0.00000	-0.10000	-0.1	13
0.00000	0.00000	0	7
1.00000	1.00000	1	10
100.05000	-100.05000	100.05	1
100000.00000	-100000.00000	100000	5
100000.00000	100000.00000	111111000	19
12345.00000	NULL	NULL	NULL
SELECT * FROM t1 WHERE c2 >= '-99999.99999' AND c2 < '0.0' AND c1 = '99999.99999' ORDER BY c1,c2;
c1	c2	c3	c4
SELECT * FROM t1 WHERE c2 >= '-99999.99999' AND c2 < '0.0' AND c1 = '99999.99999' ORDER BY c1,c2 LIMIT 2;
c1	c2	c3	c4
SELECT * FROM t1 WHERE c2 >= '-99999.99999' AND c2 < '0.0' AND c1 = '99999.99999' ORDER BY c1,c2 DESC;
c1	c2	c3	c4
SELECT * FROM t1 WHERE c2 >= '-99999.99999' AND c2 < '0.0' AND c1 = '99999.99999' ORDER BY c1,c2 DESC LIMIT 2;
c1	c2	c3	c4
DROP TABLE t1;
CREATE TABLE t1(c1 DATE NOT NULL, c2 DATE NULL, c3 DATETIME, c4 TIMESTAMP, PRIMARY KEY(c1), UNIQUE INDEX(c2));
CREATE TABLE t2(c1 DATE NOT NULL, c2 DATE NULL, c3 DATETIME, c4 TIMESTAMP, PRIMARY KEY(c1,c2));
CREATE TABLE t3(c1 DATE NOT NULL, c2 DATE NULL, c3 DATETIME, c4 TIMESTAMP, UNIQUE INDEX idx(c1,c2));
INSERT INTO t1 VALUES('98-12-31 11:30:45','98.12.31 11+30+45','98-12-31 11:30:45','98.12.31 11+30+45'),('98/12/30 11*30*45','98@12@30 11^30^45','98/12/30 11*30*45','98@12@30 11^30^45'),('98-12-29','98.12.29','98-12-29','98.12.29'),('98/12/28','98@12@28','98/12/28','98@12@28');
Warnings:
Note	1265	Data truncated for column 'c1' at row 1
Note	1265	Data truncated for column 'c2' at row 1
Note	1265	Data truncated for column 'c1' at row 2
Note	1265	Data truncated for column 'c2' at row 2
INSERT INTO t2 VALUES('98-12-31 11:30:45','98.12.31 11+30+45','98-12-31 11:30:45','98.12.31 11+30+45'),('98/12/30 11*30*45','98@12@30 11^30^45','98/12/30 11*30*45','98@12@30 11^30^45'),('98-12-29','98.12.29','98-12-29','98.12.29'),('98/12/28','98@12@28','98/12/28','98@12@28');
Warnings:
Note	1265	Data truncated for column 'c1' at row 1
Note	1265	Data truncated for column 'c2' at row 1
Note	1265	Data truncated for column 'c1' at row 2
Note	1265	Data truncated for column 'c2' at row 2
INSERT INTO t3 VALUES('98-12-31 11:30:45','98.12.31 11+30+45','98-12-31 11:30:45','98.12.31 11+30+45'),('98/12/30 11*30*45','98@12@30 11^30^45','98/12/30 11*30*45','98@12@30 11^30^45'),('98-12-29','98.12.29','98-12-29','98.12.29'),('98/12/28','98@12@28','98/12/28','98@12@28');
Warnings:
Note	1265	Data truncated for column 'c1' at row 1
Note	1265	Data truncated for column 'c2' at row 1
Note	1265	Data truncated for column 'c1' at row 2
Note	1265	Data truncated for column 'c2' at row 2
INSERT INTO t1 VALUES('20070523091528','070523091528','20070524091528','070524091528'),('20070525','070525','20070526','070526');
Warnings:
Note	1265	Data truncated for column 'c1' at row 1
Note	1265	Data truncated for column 'c2' at row 1
INSERT INTO t2 VALUES('20070523091528','070523091528','20070524091528','070524091528'),('20070525','070525','20070526','070526');
Warnings:
Note	1265	Data truncated for column 'c1' at row 1
Note	1265	Data truncated for column 'c2' at row 1
INSERT INTO t3 VALUES('20070523091528','070523091528','20070524091528','070524091528'),('20070525','070525','20070526','070526');
Warnings:
Note	1265	Data truncated for column 'c1' at row 1
Note	1265	Data truncated for column 'c2' at row 1
INSERT INTO t1 VALUES(19830905132800,830905132800,19830906132800,830906132800),(19830907,830907,19830908,830908);
Warnings:
Note	1265	Data truncated for column 'c1' at row 1
Note	1265	Data truncated for column 'c2' at row 1
INSERT INTO t2 VALUES(19830905132800,830905132800,19830906132800,830906132800),(19830907,830907,19830908,830908);
Warnings:
Note	1265	Data truncated for column 'c1' at row 1
Note	1265	Data truncated for column 'c2' at row 1
INSERT INTO t3 VALUES(19830905132800,830905132800,19830906132800,830906132800),(19830907,830907,19830908,830908);
Warnings:
Note	1265	Data truncated for column 'c1' at row 1
Note	1265	Data truncated for column 'c2' at row 1
SET TIMESTAMP=1233216687;
INSERT INTO t1 VALUES(NOW(),CURRENT_DATE,NOW(),CURRENT_DATE);
Warnings:
Note	1265	Data truncated for column 'c1' at row 1
INSERT INTO t2 VALUES(NOW(),CURRENT_DATE,NOW(),CURRENT_DATE);
Warnings:
Note	1265	Data truncated for column 'c1' at row 1
INSERT INTO t3 VALUES(NOW(),CURRENT_DATE,NOW(),CURRENT_DATE);
Warnings:
Note	1265	Data truncated for column 'c1' at row 1
INSERT INTO t2 VALUES('98-12-31 11:30:45','98@12@30 11^30^45','98-12-31 11:30:45','98.12.31 11+30+45'),('98-12-29','98@12@30 11^30^45','98/12/30 11*30*45','98@12@30 11^30^45');
Warnings:
Note	1265	Data truncated for column 'c1' at row 1
Note	1265	Data truncated for column 'c2' at row 1
Note	1265	Data truncated for column 'c2' at row 2
INSERT INTO t3 VALUES('98-12-31 11:30:45','98@12@30 11^30^45','98-12-31 11:30:45','98.12.31 11+30+45'),('98-12-29','98@12@30 11^30^45','98/12/30 11*30*45','98@12@30 11^30^45');
Warnings:
Note	1265	Data truncated for column 'c1' at row 1
Note	1265	Data truncated for column 'c2' at row 1
Note	1265	Data truncated for column 'c2' at row 2
INSERT INTO t1 VALUES('2008-01-01',NULL,'08-01-02','08/01/03');
INSERT INTO t3 VALUES('2008-01-01',NULL,'08-01-02','08/01/03');
INSERT INTO t1(c1,c2) VALUES('08/01/17',NULL);
DELETE FROM t1 WHERE c1='08/01/17' AND c2 IS NULL;
INSERT INTO t1 VALUES('','','08-01-04','08/01/05') /* Inserts zero dates for '' strings */;
Warnings:
Warning	1265	Data truncated for column 'c1' at row 1
Warning	1265	Data truncated for column 'c2' at row 1
INSERT INTO t2 VALUES('2008-04-31','2008-04-31','08-01-06','08/01/07') /* Inserts zero dates for invalid dates */;
Warnings:
Warning	1265	Data truncated for column 'c1' at row 1
Warning	1265	Data truncated for column 'c2' at row 1
INSERT INTO t3 VALUES('10:45:15','10:45:15','08-01-08','08/1/9') /* Inserts zero dates for invalid dates */;
Warnings:
Warning	1265	Data truncated for column 'c1' at row 1
Warning	1265	Data truncated for column 'c2' at row 1
INSERT INTO t2 VALUES('0000-00-00','08-01-06','08-01-06','08/01/07');
INSERT INTO t3 VALUES('08-01-06','00-00-00','08-01-08','08/1/9');
SELECT * FROM t1;
c1	c2	c3	c4
0000-00-00	0000-00-00	2008-01-04 00:00:00	2008-01-05 00:00:00
1983-09-05	1983-09-05	1983-09-06 13:28:00	1983-09-06 13:28:00
1983-09-07	1983-09-07	1983-09-08 00:00:00	1983-09-08 00:00:00
1998-12-28	1998-12-28	1998-12-28 00:00:00	1998-12-28 00:00:00
1998-12-29	1998-12-29	1998-12-29 00:00:00	1998-12-29 00:00:00
1998-12-30	1998-12-30	1998-12-30 11:30:45	1998-12-30 11:30:45
1998-12-31	1998-12-31	1998-12-31 11:30:45	1998-12-31 11:30:45
2007-05-23	2007-05-23	2007-05-24 09:15:28	2007-05-24 09:15:28
2007-05-25	2007-05-25	2007-05-26 00:00:00	2007-05-26 00:00:00
2008-01-01	NULL	2008-01-02 00:00:00	2008-01-03 00:00:00
2009-01-29	2009-01-29	2009-01-29 11:11:27	2009-01-29 00:00:00
SELECT * FROM t2;
c1	c2	c3	c4
0000-00-00	0000-00-00	2008-01-06 00:00:00	2008-01-07 00:00:00
0000-00-00	2008-01-06	2008-01-06 00:00:00	2008-01-07 00:00:00
1983-09-05	1983-09-05	1983-09-06 13:28:00	1983-09-06 13:28:00
1983-09-07	1983-09-07	1983-09-08 00:00:00	1983-09-08 00:00:00
1998-12-28	1998-12-28	1998-12-28 00:00:00	1998-12-28 00:00:00
1998-12-29	1998-12-29	1998-12-29 00:00:00	1998-12-29 00:00:00
1998-12-29	1998-12-30	1998-12-30 11:30:45	1998-12-30 11:30:45
1998-12-30	1998-12-30	1998-12-30 11:30:45	1998-12-30 11:30:45
1998-12-31	1998-12-30	1998-12-31 11:30:45	1998-12-31 11:30:45
1998-12-31	1998-12-31	1998-12-31 11:30:45	1998-12-31 11:30:45
2007-05-23	2007-05-23	2007-05-24 09:15:28	2007-05-24 09:15:28
2007-05-25	2007-05-25	2007-05-26 00:00:00	2007-05-26 00:00:00
2009-01-29	2009-01-29	2009-01-29 11:11:27	2009-01-29 00:00:00
SELECT * FROM t3;
c1	c2	c3	c4
0000-00-00	0000-00-00	2008-01-08 00:00:00	2008-01-09 00:00:00
1983-09-05	1983-09-05	1983-09-06 13:28:00	1983-09-06 13:28:00
1983-09-07	1983-09-07	1983-09-08 00:00:00	1983-09-08 00:00:00
1998-12-28	1998-12-28	1998-12-28 00:00:00	1998-12-28 00:00:00
1998-12-29	1998-12-29	1998-12-29 00:00:00	1998-12-29 00:00:00
1998-12-29	1998-12-30	1998-12-30 11:30:45	1998-12-30 11:30:45
1998-12-30	1998-12-30	1998-12-30 11:30:45	1998-12-30 11:30:45
1998-12-31	1998-12-30	1998-12-31 11:30:45	1998-12-31 11:30:45
1998-12-31	1998-12-31	1998-12-31 11:30:45	1998-12-31 11:30:45
2007-05-23	2007-05-23	2007-05-24 09:15:28	2007-05-24 09:15:28
2007-05-25	2007-05-25	2007-05-26 00:00:00	2007-05-26 00:00:00
2008-01-01	NULL	2008-01-02 00:00:00	2008-01-03 00:00:00
2008-01-06	0000-00-00	2008-01-08 00:00:00	2008-01-09 00:00:00
2009-01-29	2009-01-29	2009-01-29 11:11:27	2009-01-29 00:00:00
SELECT * FROM t1 WHERE c1 > '1998-12-31 11:30:45' ORDER BY c1;
c1	c2	c3	c4
2007-05-23	2007-05-23	2007-05-24 09:15:28	2007-05-24 09:15:28
2007-05-25	2007-05-25	2007-05-26 00:00:00	2007-05-26 00:00:00
2008-01-01	NULL	2008-01-02 00:00:00	2008-01-03 00:00:00
2009-01-29	2009-01-29	2009-01-29 11:11:27	2009-01-29 00:00:00
SELECT * FROM t1 WHERE c1 > '1998-12-31 11:30:45' ORDER BY c1 LIMIT 2;
c1	c2	c3	c4
2007-05-23	2007-05-23	2007-05-24 09:15:28	2007-05-24 09:15:28
2007-05-25	2007-05-25	2007-05-26 00:00:00	2007-05-26 00:00:00
SELECT * FROM t1 WHERE c1 >= '1998-12-31 11:30:45' ORDER BY c1;
c1	c2	c3	c4
2007-05-23	2007-05-23	2007-05-24 09:15:28	2007-05-24 09:15:28
2007-05-25	2007-05-25	2007-05-26 00:00:00	2007-05-26 00:00:00
2008-01-01	NULL	2008-01-02 00:00:00	2008-01-03 00:00:00
2009-01-29	2009-01-29	2009-01-29 11:11:27	2009-01-29 00:00:00
SELECT * FROM t1 WHERE c1 >= '1998-12-31 11:30:45' ORDER BY c1 LIMIT 2;
c1	c2	c3	c4
2007-05-23	2007-05-23	2007-05-24 09:15:28	2007-05-24 09:15:28
2007-05-25	2007-05-25	2007-05-26 00:00:00	2007-05-26 00:00:00
SELECT * FROM t1 WHERE c2 > '1998-12-30 11:30:45' ORDER BY c2;
c1	c2	c3	c4
1998-12-31	1998-12-31	1998-12-31 11:30:45	1998-12-31 11:30:45
2007-05-23	2007-05-23	2007-05-24 09:15:28	2007-05-24 09:15:28
2007-05-25	2007-05-25	2007-05-26 00:00:00	2007-05-26 00:00:00
2009-01-29	2009-01-29	2009-01-29 11:11:27	2009-01-29 00:00:00
SELECT * FROM t1 WHERE c2 > '1998-12-30 11:30:45' ORDER BY c2 LIMIT 2;
c1	c2	c3	c4
1998-12-31	1998-12-31	1998-12-31 11:30:45	1998-12-31 11:30:45
2007-05-23	2007-05-23	2007-05-24 09:15:28	2007-05-24 09:15:28
SELECT * FROM t1 WHERE c2 >= '1998-12-30 11:30:45' ORDER BY c2;
c1	c2	c3	c4
1998-12-31	1998-12-31	1998-12-31 11:30:45	1998-12-31 11:30:45
2007-05-23	2007-05-23	2007-05-24 09:15:28	2007-05-24 09:15:28
2007-05-25	2007-05-25	2007-05-26 00:00:00	2007-05-26 00:00:00
2009-01-29	2009-01-29	2009-01-29 11:11:27	2009-01-29 00:00:00
SELECT * FROM t1 WHERE c2 >= '1998-12-30 11:30:45' ORDER BY c2 LIMIT 2;
c1	c2	c3	c4
1998-12-31	1998-12-31	1998-12-31 11:30:45	1998-12-31 11:30:45
2007-05-23	2007-05-23	2007-05-24 09:15:28	2007-05-24 09:15:28
SELECT * FROM t2 WHERE c1 > '1998-12-29 00:00:00' ORDER BY c1,c2 LIMIT 2;
c1	c2	c3	c4
1998-12-30	1998-12-30	1998-12-30 11:30:45	1998-12-30 11:30:45
1998-12-31	1998-12-30	1998-12-31 11:30:45	1998-12-31 11:30:45
SELECT * FROM t3 WHERE c1 > '1998-12-28 00:00:00' ORDER BY c1,c2 LIMIT 2;
c1	c2	c3	c4
1998-12-29	1998-12-29	1998-12-29 00:00:00	1998-12-29 00:00:00
1998-12-29	1998-12-30	1998-12-30 11:30:45	1998-12-30 11:30:45
SELECT * FROM t3 WHERE c1 BETWEEN '1998-12-31 11:30:45' AND '2008-01-06 00:00:00' ORDER BY c1,c2;
c1	c2	c3	c4
2007-05-23	2007-05-23	2007-05-24 09:15:28	2007-05-24 09:15:28
2007-05-25	2007-05-25	2007-05-26 00:00:00	2007-05-26 00:00:00
2008-01-01	NULL	2008-01-02 00:00:00	2008-01-03 00:00:00
2008-01-06	0000-00-00	2008-01-08 00:00:00	2008-01-09 00:00:00
SELECT * FROM t3 WHERE c1 BETWEEN '1998-12-31 11:30:45' AND '2008-01-06 00:00:00' ORDER BY c1,c2 LIMIT 2;
c1	c2	c3	c4
2007-05-23	2007-05-23	2007-05-24 09:15:28	2007-05-24 09:15:28
2007-05-25	2007-05-25	2007-05-26 00:00:00	2007-05-26 00:00:00
DROP TABLE t1,t2,t3;
