*** Bug #43452 ***
SET @@storage_engine = 'Falcon';
DROP TABLE IF EXISTS t1;
CREATE TABLE t1 (int_key INTEGER, KEY (int_key));
INSERT INTO t1 VALUES (1), (8);
UPDATE t1 SET int_key = 3;
SELECT * FROM t1 WHERE int_key < 8;
int_key
3
3
SELECT * FROM t1 WHERE int_key < 8 ORDER BY int_key LIMIT 4;
int_key
3
3
DROP TABLE t1;
CREATE TABLE t1 (int_key INTEGER, KEY (int_key));
INSERT INTO t1 VALUES (8), (1);
UPDATE t1 SET int_key = 3;
SELECT * FROM t1 WHERE int_key < 8;
int_key
3
3
SELECT * FROM t1 WHERE int_key < 8 ORDER BY int_key LIMIT 4;
int_key
3
3
SELECT count(*) FROM t1;
count(*)
2
DROP TABLE t1;
